{
  "schema": "simplicio.agent-instance/v1",
  "agent_instance_id": "ai-implement-0001",
  "role_id": "implementer",
  "role_version": "1.0.0",
  "stage_id": "implement",
  "stage_version": "1.0.0",
  "run_id": "run-1",
  "task_id": "task-1",
  "work_item_id": "wi-1",
  "attempt_id": "attempt-1",
  "fence": 1,
  "plan_revision": 1,
  "coordinator_agent_id": "ai-coordinate-0001",
  "parent_instance_id": "ai-coordinate-0001",
  "runtime": "claude",
  "provider": "anthropic",
  "model": "claude-sonnet-5",
  "driver": "claude-code",
  "capabilities": [
    "claim",
    "heartbeat",
    "receipts"
  ],
  "isolation_level": "fresh-context",
  "context_hash": "sha256:9bf558cf47fd57b0ad02a89e8b135c1ef619ddf5b842ac1746bc8a8a271cd460",
  "input_hash": "sha256:f7218970d1a5858b1d37bd7f2935222ceb12c787fc91ee5e9ebf03584d5b2a02",
  "manifest_hash": "sha256:396c00555fb67668f7c41d51f3d03277dd3d8084b862af6d35abdd0705c35980",
  "status": "running",
  "created_at": "2026-07-16T10:00:00Z",
  "ready_at": "2026-07-16T10:00:01Z",
  "running_at": "2026-07-16T10:00:02Z",
  "terminal_at": "",
  "idempotency_key": "run-1:task-1:implement:attempt-1"
}